{
  "schema_version": "1.0.0",
  "eval_id": "20261009T153000Z_e12345",
  "status": "done",
  "created_utc": "2026-10-09T15:00:00Z",
  "run": {
    "run_id": "20261009T140000Z_elbow_s42",
    "run_status": "done",
    "seed": 42,
    "train_seeds": [
      42
    ]
  },
  "checkpoint": {
    "path": "checkpoints/ckpt_u000020_final.pt",
    "sha256": "aaaaaaaaaaaaaaaaaaaaaaaaaaaaaaaaaaaaaaaaaaaaaaaaaaaaaaaaaaaaaaaa",
    "update_idx": 20,
    "env_steps": 40960,
    "model_sha256": "bbbbbbbbbbbbbbbbbbbbbbbbbbbbbbbbbbbbbbbbbbbbbbbbbbbbbbbbbbbbbbbb"
  },
  "model": {
    "sha256": "bbbbbbbbbbbbbbbbbbbbbbbbbbbbbbbbbbbbbbbbbbbbbbbbbbbbbbbbbbbbbbbb",
    "muscle_names": [
      "m0",
      "m1",
      "m2",
      "m3",
      "m4",
      "m5"
    ]
  },
  "library_versions": {
    "python": "3.11.15",
    "numpy": "2.4.6",
    "pandas": "3.0.6",
    "matplotlib": "3.11.2",
    "torch": "2.14.1",
    "gymnasium": "1.4.0",
    "mujoco": "3.15.0"
  },
  "device": {
    "kind": "cpu",
    "name": null,
    "checkpoint_saved_with": null
  },
  "criterion": {
    "primary_metric": "success_rate",
    "confidence_level": 0.95,
    "rule": "better_iff_ci_lower_bound_of_difference_gt_0",
    "declared_before_run": true
  },
  "config": {
    "schema_version": "1.0.0",
    "seeds": {
      "episode_base": 12345,
      "random_policy": 12345
    },
    "episodes": {
      "repeats": 1,
      "min_targets": 2
    },
    "criterion": {
      "primary_metric": "success_rate",
      "confidence_level": 0.95
    },
    "stats": {
      "bootstrap_resamples": 10000,
      "bootstrap_seed": 0
    },
    "logs": {
      "source": "auto",
      "tags": {
        "loss_prefix": "loss",
        "reward_prefix": "reward",
        "activation_prefix": "activation/"
      }
    },
    "charts": {
      "dpi": 120,
      "format": "png"
    },
    "paths": {
      "runs_dir": "runs",
      "env_config_override": null,
      "expect_fingerprint_sha256": null
    }
  },
  "disjointness": {
    "checked": true,
    "passed": true,
    "train_target_provenance": "rebuilt_from_config",
    "target_fingerprint_sha256": "cccccccccccccccccccccccccccccccccccccccccccccccccccccccccccccccc",
    "n_train_targets": 200,
    "n_eval_targets": 50,
    "min_cross_distance_m": 0.021,
    "min_required_m": 0.02,
    "eval_seed_range": [
      12345,
      12395
    ],
    "random_policy_seed": 12345,
    "train_seeds": [
      42
    ]
  },
  "policies": {
    "learned": {
      "kind": "learned",
      "n_episodes": 50,
      "success_rate": {
        "value": 0.6,
        "ci_low": 0.462,
        "ci_high": 0.724,
        "n": 50,
        "reason": null
      },
      "final_distance_m": {
        "value": 0.031,
        "ci_low": 0.024,
        "ci_high": 0.04,
        "n": 50,
        "reason": null
      },
      "mean_return": {
        "value": 12.5,
        "ci_low": 10.1,
        "ci_high": 14.9,
        "n": 50,
        "reason": null
      },
      "effort": {
        "value": 0.41,
        "ci_low": 0.37,
        "ci_high": 0.45,
        "n": 50,
        "reason": null
      },
      "activation_per_muscle": [
        0.5,
        0.4,
        0.3,
        0.45,
        0.4,
        0.41
      ],
      "abnormal_rate": {
        "value": 0.0,
        "ci_low": 0.0,
        "ci_high": 0.071,
        "n": 50,
        "reason": null
      },
      "n_abnormal": 0,
      "nan_count": 0,
      "inf_count": 0
    },
    "random": {
      "kind": "random",
      "n_episodes": 50,
      "success_rate": {
        "value": 0.0,
        "ci_low": 0.0,
        "ci_high": 0.071,
        "n": 50,
        "reason": null
      },
      "final_distance_m": {
        "value": null,
        "ci_low": null,
        "ci_high": null,
        "n": 0,
        "reason": "mọi episode kết thúc bất thường"
      },
      "mean_return": {
        "value": 3.2,
        "ci_low": 2.4,
        "ci_high": 4.0,
        "n": 50,
        "reason": null
      },
      "effort": {
        "value": 0.5,
        "ci_low": 0.49,
        "ci_high": 0.51,
        "n": 50,
        "reason": null
      },
      "activation_per_muscle": [
        0.5,
        0.5,
        0.49,
        0.51,
        0.5,
        0.5
      ],
      "abnormal_rate": {
        "value": 1.0,
        "ci_low": 0.929,
        "ci_high": 1.0,
        "n": 50,
        "reason": null
      },
      "n_abnormal": 50,
      "nan_count": 0,
      "inf_count": 0
    }
  },
  "comparison": {
    "metric": "success_rate",
    "difference": 0.4,
    "ci_low": 0.21,
    "ci_high": 0.552,
    "confidence_level": 0.95,
    "better": true,
    "ci_method": "newcombe_wilson_hybrid",
    "approximate": false,
    "n_units_each": 50,
    "note": null
  },
  "charts": {
    "status": "complete",
    "files": {
      "loss": "charts/loss.png",
      "reward": "charts/reward.png",
      "activation": "charts/activation.png"
    },
    "points_plotted": {
      "loss": 20,
      "reward": 20,
      "activation": 120
    },
    "points_dropped": 0,
    "reason": null,
    "log_source": "jsonl"
  },
  "timing": {
    "wall_clock_seconds": 12.3,
    "episodes_per_second": 8.1
  },
  "limits": [
    "50 episode mỗi policy: khoảng tin cậy của hiệu rộng ≈ 0,34; chênh lệch nhỏ hơn mức này không phát hiện được.",
    "Kết luận chỉ áp cho checkpoint, tập mục tiêu kiểm thử và cấu hình ghi ở trên; không khẳng định chất lượng policy ngoài số đo này."
  ]
}
